{
  "id": "enzyme_screen_layout_v1",
  "workflow_id": "enzyme_screen_wf_v1",
  "room": {
    "width_m": 6,
    "depth_m": 4,
    "height_m": 3
  },
  "placements": [
    {
      "instance_id": "arm_1",
      "position": {
        "x": 3,
        "y": 2,
        "z": 0.9
      },
      "rotation_deg": 0
    },
    {
      "instance_id": "lh_1",
      "position": {
        "x": 3,
        "y": 1.05,
        "z": 0.9
      },
      "rotation_deg": 0
    },
    {
      "instance_id": "incubator_1",
      "position": {
        "x": 2.0,
        "y": 2.0,
        "z": 0.9
      },
      "rotation_deg": 0
    },
    {
      "instance_id": "reader_1",
      "position": {
        "x": 4.0,
        "y": 2.0,
        "z": 0.9
      },
      "rotation_deg": 0
    },
    {
      "instance_id": "sealer_1",
      "position": {
        "x": 3,
        "y": 2.8,
        "z": 0.9
      },
      "rotation_deg": 0
    },
    {
      "instance_id": "hotel_1",
      "position": {
        "x": 3.7,
        "y": 2.75,
        "z": 0.9
      },
      "rotation_deg": 0
    }
  ],
  "transfers": [
    {
      "from_instance": "hotel_1",
      "to_instance": "lh_1",
      "transporter_instance": "arm_1",
      "distance_m": 1.47,
      "est_time_s": 10.9,
      "path": [
        {
          "x": 3.6,
          "y": 2.55,
          "z": 1.0
        },
        {
          "x": 3,
          "y": 2,
          "z": 1.2
        },
        {
          "x": 3,
          "y": 1.4,
          "z": 1.0
        }
      ]
    },
    {
      "from_instance": "lh_1",
      "to_instance": "sealer_1",
      "transporter_instance": "arm_1",
      "distance_m": 1.22,
      "est_time_s": 10.4,
      "path": [
        {
          "x": 3,
          "y": 1.4,
          "z": 1.0
        },
        {
          "x": 3,
          "y": 2,
          "z": 1.2
        },
        {
          "x": 3,
          "y": 2.55,
          "z": 1.0
        }
      ]
    },
    {
      "from_instance": "sealer_1",
      "to_instance": "incubator_1",
      "transporter_instance": "arm_1",
      "distance_m": 1.24,
      "est_time_s": 10.5,
      "path": [
        {
          "x": 3,
          "y": 2.55,
          "z": 1.0
        },
        {
          "x": 3,
          "y": 2,
          "z": 1.2
        },
        {
          "x": 2.35,
          "y": 2.0,
          "z": 1.1
        }
      ]
    },
    {
      "from_instance": "incubator_1",
      "to_instance": "reader_1",
      "transporter_instance": "arm_1",
      "distance_m": 1.43,
      "est_time_s": 10.9,
      "path": [
        {
          "x": 2.35,
          "y": 2.0,
          "z": 1.1
        },
        {
          "x": 3,
          "y": 2,
          "z": 1.2
        },
        {
          "x": 3.75,
          "y": 2.0,
          "z": 1.0
        }
      ]
    },
    {
      "from_instance": "reader_1",
      "to_instance": "hotel_1",
      "transporter_instance": "arm_1",
      "distance_m": 1.61,
      "est_time_s": 11.2,
      "path": [
        {
          "x": 3.75,
          "y": 2.0,
          "z": 1.0
        },
        {
          "x": 3,
          "y": 2,
          "z": 1.2
        },
        {
          "x": 3.6,
          "y": 2.55,
          "z": 1.0
        }
      ]
    }
  ],
  "score": {
    "total_weighted_distance_m": 6.97,
    "floor_area_used_m2": 4.2
  },
  "violations": []
}
